{
  "definition_id": "ubbl2016.fountain",
  "term": "fountain",
  "aliases": [
    "fountain",
    "Fountains"
  ],
  "link_in_text": false,
  "applies_to": {
    "land_use": "residential_plotted",
    "authority": "DDA"
  },
  "text": {
    "original": "Fountain: An artificially created jet or stream of water with or without structural form",
    "original_lang": "en",
    "translated": null
  },
  "effective_from": "2016-03-22",
  "effective_to": null,
  "supersedes": null,
  "citations": [
    {
      "doc_id": "ubbl2016",
      "clause": "1.4.51",
      "page": 299,
      "bbox": [
        0.2164,
        0.4586,
        0.8776,
        0.4867
      ],
      "original_text": "Fountain: An artificially created jet or stream of water with or without structural form",
      "original_lang": "en",
      "translated_text": null
    },
    {
      "doc_id": "ubbl2016_compendium_2020",
      "clause": "1.4.51",
      "page": 10,
      "bbox": [
        0.1442,
        0.7984,
        0.736,
        0.8155
      ],
      "original_text": "Fountain: An artificially created jet or stream of water with or without structural form",
      "original_lang": "en",
      "translated_text": null
    }
  ],
  "verification": {
    "status": "draft",
    "verified_by": null,
    "verified_on": null,
    "method": "pdf_text_extraction_v1",
    "confidence": null
  },
  "notes": "Read from the English text of ubbl2016, clause 1.4.51 by pipeline.definitions — no model involved. Confirm the text and box against the page. TODO(verify): effective_from 2016-03-22 is the date of S.O. 1191(E), as used by the verified UBBL rules; clause 1.0 says the bye-laws come into force on a date appointed by notification. Hindi text not read: the gazette's Hindi half uses a legacy font encoding (pipeline/README.md). Same text in ubbl2016_compendium_2020 p.10."
}
