{
  "definition_id": "ubbl2016.building_line",
  "term": "building line",
  "aliases": [
    "building line",
    "Building Lines"
  ],
  "link_in_text": true,
  "applies_to": {
    "land_use": "residential_plotted",
    "authority": "DDA"
  },
  "text": {
    "original": "Building Line: The line up to which the plinth of a building adjoining a street or an extension of a street or on a future street may lawfully extend. It includes the lines prescribed in the MPD or specifically indicated in any Scheme or Layout Plan, or in these Bye-Laws.",
    "original_lang": "en",
    "translated": null
  },
  "effective_from": "2016-03-22",
  "effective_to": null,
  "supersedes": null,
  "citations": [
    {
      "doc_id": "ubbl2016",
      "clause": "1.4.17",
      "page": 296,
      "bbox": [
        0.1926,
        0.8607,
        0.8777,
        0.9039
      ],
      "original_text": "Building Line: The line up to which the plinth of a building adjoining a street or an extension of a street or on a future street may lawfully extend. It includes the lines prescribed in the MPD or specifically indicated in any Scheme or Layout Plan, or in these Bye-Laws.",
      "original_lang": "en",
      "translated_text": null
    },
    {
      "doc_id": "ubbl2016_compendium_2020",
      "clause": "1.4.17",
      "page": 8,
      "bbox": [
        0.1397,
        0.7433,
        0.919,
        0.799
      ],
      "original_text": "Building Line: The line up to which the plinth of a building adjoining a street or an extension of a street or on a future street may lawfully extend. It includes the lines prescribed in the MPD or specifically indicated in any Scheme or Layout Plan, or in these Bye-Laws.",
      "original_lang": "en",
      "translated_text": null
    }
  ],
  "verification": {
    "status": "draft",
    "verified_by": null,
    "verified_on": null,
    "method": "pdf_text_extraction_v1",
    "confidence": null
  },
  "notes": "Read from the English text of ubbl2016, clause 1.4.17 (continues on p.297) by pipeline.definitions — no model involved. Confirm the text and box against the page. TODO(verify): effective_from 2016-03-22 is the date of S.O. 1191(E), as used by the verified UBBL rules; clause 1.0 says the bye-laws come into force on a date appointed by notification. Hindi text not read: the gazette's Hindi half uses a legacy font encoding (pipeline/README.md). Same text in ubbl2016_compendium_2020 p.8."
}
