{
  "definition_id": "ubbl2016.drain",
  "term": "drain",
  "aliases": [
    "drain",
    "Drains"
  ],
  "link_in_text": false,
  "applies_to": {
    "land_use": "residential_plotted",
    "authority": "DDA"
  },
  "text": {
    "original": "Drain: A line of pipes including all fittings and equipment such as manholes, inspection chambers, traps, gullies and floor traps used for the drainage of a building, or a number of buildings or yards appurtenant to the buildings, within the same curtilage. Drain shall also include open channels used for conveying surface water.",
    "original_lang": "en",
    "translated": null
  },
  "effective_from": "2016-03-22",
  "effective_to": null,
  "supersedes": null,
  "citations": [
    {
      "doc_id": "ubbl2016",
      "clause": "1.4.30",
      "page": 297,
      "bbox": [
        0.2164,
        0.6811,
        0.8777,
        0.7544
      ],
      "original_text": "Drain: A line of pipes including all fittings and equipment such as manholes, inspection chambers, traps, gullies and floor traps used for the drainage of a building, or a number of buildings or yards appurtenant to the buildings, within the same curtilage. Drain shall also include open channels used for conveying surface water.",
      "original_lang": "en",
      "translated_text": null
    },
    {
      "doc_id": "ubbl2016_compendium_2020",
      "clause": "1.4.30",
      "page": 9,
      "bbox": [
        0.1397,
        0.5191,
        0.9189,
        0.5757
      ],
      "original_text": "Drain: A line of pipes including all fittings and equipment such as manholes, inspection chambers, traps, gullies and floor traps used for the drainage of a building, or a number of buildings or yards appurtenant to the buildings, within the same curtilage. Drain shall also include open channels used for conveying surface water.",
      "original_lang": "en",
      "translated_text": null
    }
  ],
  "verification": {
    "status": "draft",
    "verified_by": null,
    "verified_on": null,
    "method": "pdf_text_extraction_v1",
    "confidence": null
  },
  "notes": "Read from the English text of ubbl2016, clause 1.4.30 by pipeline.definitions — no model involved. Confirm the text and box against the page. TODO(verify): effective_from 2016-03-22 is the date of S.O. 1191(E), as used by the verified UBBL rules; clause 1.0 says the bye-laws come into force on a date appointed by notification. Hindi text not read: the gazette's Hindi half uses a legacy font encoding (pipeline/README.md). Same text in ubbl2016_compendium_2020 p.9."
}
