{
  "definition_id": "ubbl2016.detached_building",
  "term": "detached building",
  "aliases": [
    "detached building",
    "Detached Buildings"
  ],
  "link_in_text": true,
  "applies_to": {
    "land_use": "residential_plotted",
    "authority": "DDA"
  },
  "text": {
    "original": "Detached Building: A building whose walls and roofs are independent of any other building with open spaces on all sides as specified.",
    "original_lang": "en",
    "translated": null
  },
  "effective_from": "2016-03-22",
  "effective_to": null,
  "supersedes": null,
  "citations": [
    {
      "doc_id": "ubbl2016",
      "clause": "1.4.29",
      "page": 297,
      "bbox": [
        0.2164,
        0.644,
        0.8777,
        0.6721
      ],
      "original_text": "Detached Building: A building whose walls and roofs are independent of any other building with open spaces on all sides as specified.",
      "original_lang": "en",
      "translated_text": null
    },
    {
      "doc_id": "ubbl2016_compendium_2020",
      "clause": "1.4.29",
      "page": 9,
      "bbox": [
        0.1397,
        0.4725,
        0.9188,
        0.5094
      ],
      "original_text": "Detached Building: A building whose walls and roofs are independent of any other building with open spaces on all sides as specified.",
      "original_lang": "en",
      "translated_text": null
    }
  ],
  "verification": {
    "status": "draft",
    "verified_by": null,
    "verified_on": null,
    "method": "pdf_text_extraction_v1",
    "confidence": null
  },
  "notes": "Read from the English text of ubbl2016, clause 1.4.29 by pipeline.definitions — no model involved. Confirm the text and box against the page. TODO(verify): effective_from 2016-03-22 is the date of S.O. 1191(E), as used by the verified UBBL rules; clause 1.0 says the bye-laws come into force on a date appointed by notification. Hindi text not read: the gazette's Hindi half uses a legacy font encoding (pipeline/README.md). Same text in ubbl2016_compendium_2020 p.9."
}
