{
  "definition_id": "ubbl2016.road_width",
  "term": "road width",
  "aliases": [
    "road width",
    "Width of Road",
    "Width of Roads"
  ],
  "link_in_text": true,
  "applies_to": {
    "land_use": "residential_plotted",
    "authority": "DDA"
  },
  "text": {
    "original": "Width of Road: The whole extent of space within the boundaries of road when applied to a new road, as laid down in the surveys of the city or development plans and measured at right angles to the course or intended course of direction of such road.",
    "original_lang": "en",
    "translated": null
  },
  "effective_from": "2016-03-22",
  "effective_to": null,
  "supersedes": "draft.road_width",
  "citations": [
    {
      "doc_id": "ubbl2016",
      "clause": "1.4.127",
      "page": 305,
      "bbox": [
        0.2164,
        0.6955,
        0.8777,
        0.7537
      ],
      "original_text": "Width of Road: The whole extent of space within the boundaries of road when applied to a new road, as laid down in the surveys of the city or development plans and measured at right angles to the course or intended course of direction of such road.",
      "original_lang": "en",
      "translated_text": null
    },
    {
      "doc_id": "ubbl2016_compendium_2020",
      "clause": "1.4.127",
      "page": 15,
      "bbox": [
        0.1442,
        0.8117,
        0.9189,
        0.8683
      ],
      "original_text": "Width of Road: The whole extent of space within the boundaries of road when applied to a new road, as laid down in the surveys of the city or development plans and measured at right angles to the course or intended course of direction of such road.",
      "original_lang": "en",
      "translated_text": null
    }
  ],
  "verification": {
    "status": "verified",
    "verified_by": "Indicodes review",
    "verified_on": "2026-10-11",
    "method": "pdf_text_extraction_v1",
    "confidence": null
  },
  "notes": "Read from the English text of ubbl2016, clause 1.4.127 by pipeline.definitions — no model involved. Confirm the text and box against the page. TODO(verify): effective_from 2016-03-22 is the date of S.O. 1191(E), as used by the verified UBBL rules; clause 1.0 says the bye-laws come into force on a date appointed by notification. Hindi text not read: the gazette's Hindi half uses a legacy font encoding (pipeline/README.md). Same text in ubbl2016_compendium_2020 p.15. Supersedes draft.road_width, the placeholder opened before this clause was found."
}
