{
  "definition_id": "ubbl2016_compendium_2020.cabin",
  "term": "cabin",
  "aliases": [
    "cabin",
    "Cabins",
    "Guard Hut",
    "Guard Huts"
  ],
  "link_in_text": true,
  "applies_to": {
    "land_use": "residential_plotted",
    "authority": "DDA"
  },
  "text": {
    "original": "Cabin / Guard Hut: A room constructed with non-load bearing partition/partitions with minimum width of 2.0 m, provided light and ventilation standards prescribed in these bye-laws are met with or the provision of light and ventilation is to the satisfaction of the Sanctioning Authority.",
    "original_lang": "en",
    "translated": null
  },
  "effective_from": null,
  "effective_to": null,
  "supersedes": "ubbl2016.cabin",
  "citations": [
    {
      "doc_id": "ubbl2016_compendium_2020",
      "clause": "1.4.19",
      "page": 8,
      "bbox": [
        0.1397,
        0.8537,
        0.9189,
        0.9094
      ],
      "original_text": "Cabin / Guard Hut: A room constructed with non-load bearing partition/partitions with minimum width of 2.0 m, provided light and ventilation standards prescribed in these bye-laws are met with or the provision of light and ventilation is to the satisfaction of the Sanctioning Authority.",
      "original_lang": "en",
      "translated_text": null
    }
  ],
  "verification": {
    "status": "draft",
    "verified_by": null,
    "verified_on": null,
    "method": "pdf_text_extraction_v1",
    "confidence": null
  },
  "notes": "Read from the English text of ubbl2016_compendium_2020, clause 1.4.19 by pipeline.definitions — no model involved. Confirm the text and box against the page. TODO(verify): reworded after 2016 by a notification not yet registered — one of the modifications listed on ubbl2016_compendium_2020 p.6. effective_from stays null, so this version cannot be verified until that notification is found and its date recorded. Hindi text not read: the gazette's Hindi half uses a legacy font encoding (pipeline/README.md)."
}
