{
  "definition_id": "ubbl2016.fire_resistance",
  "term": "fire resistance",
  "aliases": [
    "fire resistance",
    "Fire Resistances"
  ],
  "link_in_text": true,
  "applies_to": {
    "land_use": "residential_plotted",
    "authority": "DDA"
  },
  "text": {
    "original": "Fire Resistance: The time during which it fulfils its function of contributing to the fire safety of a building when subjected to prescribed conditions of heat and load or restrain. The fire resistance test of structures shall be done in accordance with good practice.",
    "original_lang": "en",
    "translated": null
  },
  "effective_from": "2016-03-22",
  "effective_to": null,
  "supersedes": null,
  "citations": [
    {
      "doc_id": "ubbl2016",
      "clause": "1.4.43",
      "page": 298,
      "bbox": [
        0.2164,
        0.6609,
        0.8777,
        0.7192
      ],
      "original_text": "Fire Resistance: The time during which it fulfils its function of contributing to the fire safety of a building when subjected to prescribed conditions of heat and load or restrain. The fire resistance test of structures shall be done in accordance with good practice.",
      "original_lang": "en",
      "translated_text": null
    },
    {
      "doc_id": "ubbl2016_compendium_2020",
      "clause": "1.4.43",
      "page": 10,
      "bbox": [
        0.1442,
        0.313,
        0.9189,
        0.3697
      ],
      "original_text": "Fire Resistance: The time during which it fulfils its function of contributing to the fire safety of a building when subjected to prescribed conditions of heat and load or restrain. The fire resistance test of structures shall be done in accordance with good practice.",
      "original_lang": "en",
      "translated_text": null
    }
  ],
  "verification": {
    "status": "draft",
    "verified_by": null,
    "verified_on": null,
    "method": "pdf_text_extraction_v1",
    "confidence": null
  },
  "notes": "Read from the English text of ubbl2016, clause 1.4.43 by pipeline.definitions — no model involved. Confirm the text and box against the page. TODO(verify): effective_from 2016-03-22 is the date of S.O. 1191(E), as used by the verified UBBL rules; clause 1.0 says the bye-laws come into force on a date appointed by notification. Hindi text not read: the gazette's Hindi half uses a legacy font encoding (pipeline/README.md). Same text in ubbl2016_compendium_2020 p.10."
}
