{
  "definition_id": "ubbl2016.floor",
  "term": "floor",
  "aliases": [
    "floor",
    "Floors"
  ],
  "link_in_text": false,
  "applies_to": {
    "land_use": "residential_plotted",
    "authority": "DDA"
  },
  "text": {
    "original": "Floor: The lower surface in a storey on which one normally walks in a building. The general term, floor, unless otherwise specifically mentioned, shall not refer to a mezzanine floor. Note: The sequential numbering of floor shall be determined by its relation to the determin-ing entrance level. For floors at or wholly above ground level the lowest floor in the building with direct entrance from the road/street shall be termed as Ground floor, the other floors above ground Floor shall be numbered in sequence as Floor 1, Floor 2, etc. with number increasing upwards.",
    "original_lang": "en",
    "translated": null
  },
  "effective_from": "2016-03-22",
  "effective_to": null,
  "supersedes": null,
  "citations": [
    {
      "doc_id": "ubbl2016",
      "clause": "1.4.47",
      "page": 299,
      "bbox": [
        0.2164,
        0.0874,
        0.8779,
        0.2144
      ],
      "original_text": "Floor: The lower surface in a storey on which one normally walks in a building. The general term, floor, unless otherwise specifically mentioned, shall not refer to a mezzanine floor. Note: The sequential numbering of floor shall be determined by its relation to the determin-ing entrance level. For floors at or wholly above ground level the lowest floor in the building with direct entrance from the road/street shall be termed as Ground floor, the other floors above ground Floor shall be numbered in sequence as Floor 1, Floor 2, etc. with number increasing upwards.",
      "original_lang": "en",
      "translated_text": null
    },
    {
      "doc_id": "ubbl2016_compendium_2020",
      "clause": "1.4.47",
      "page": 10,
      "bbox": [
        0.1442,
        0.5191,
        0.919,
        0.6421
      ],
      "original_text": "Floor: The lower surface in a storey on which one normally walks in a building. The general term, floor, unless otherwise specifically mentioned, shall not refer to a mezzanine floor. Note: The sequential numbering of floor shall be determined by its relation to the determining entrance level. For floors at or wholly above ground level the lowest floor in the building with direct entrance from the road/street shall be termed as Ground floor, the other floors above ground Floor shall be numbered in sequence as Floor 1, Floor 2, etc. with number increasing upwards.",
      "original_lang": "en",
      "translated_text": null
    }
  ],
  "verification": {
    "status": "draft",
    "verified_by": null,
    "verified_on": null,
    "method": "pdf_text_extraction_v1",
    "confidence": null
  },
  "notes": "Read from the English text of ubbl2016, clause 1.4.47 by pipeline.definitions — no model involved. Confirm the text and box against the page. TODO(verify): effective_from 2016-03-22 is the date of S.O. 1191(E), as used by the verified UBBL rules; clause 1.0 says the bye-laws come into force on a date appointed by notification. Hindi text not read: the gazette's Hindi half uses a legacy font encoding (pipeline/README.md). Same text in ubbl2016_compendium_2020 p.10."
}
