{
  "definition_id": "ubbl2016.enclosed_staircase",
  "term": "enclosed staircase",
  "aliases": [
    "enclosed staircase",
    "Enclosed Staircases"
  ],
  "link_in_text": true,
  "applies_to": {
    "land_use": "residential_plotted",
    "authority": "DDA"
  },
  "text": {
    "original": "Enclosed Staircase: A staircase separated by fire resistant walls from the rest of the building.",
    "original_lang": "en",
    "translated": null
  },
  "effective_from": "2016-03-22",
  "effective_to": null,
  "supersedes": null,
  "citations": [
    {
      "doc_id": "ubbl2016",
      "clause": "1.4.33",
      "page": 297,
      "bbox": [
        0.2164,
        0.84,
        0.8774,
        0.8706
      ],
      "original_text": "Enclosed Staircase: A staircase separated by fire resistant walls from the rest of the building.",
      "original_lang": "en",
      "translated_text": null
    },
    {
      "doc_id": "ubbl2016_compendium_2020",
      "clause": "1.4.33",
      "page": 9,
      "bbox": [
        0.1397,
        0.6587,
        0.7736,
        0.6758
      ],
      "original_text": "Enclosed Staircase: A staircase separated by fire resistant walls from the rest of the building.",
      "original_lang": "en",
      "translated_text": null
    }
  ],
  "verification": {
    "status": "draft",
    "verified_by": null,
    "verified_on": null,
    "method": "pdf_text_extraction_v1",
    "confidence": null
  },
  "notes": "Read from the English text of ubbl2016, clause 1.4.33 by pipeline.definitions — no model involved. Confirm the text and box against the page. TODO(verify): effective_from 2016-03-22 is the date of S.O. 1191(E), as used by the verified UBBL rules; clause 1.0 says the bye-laws come into force on a date appointed by notification. Hindi text not read: the gazette's Hindi half uses a legacy font encoding (pipeline/README.md). Same text in ubbl2016_compendium_2020 p.9."
}
