{
  "definition_id": "ubbl2016.masonry_unit",
  "term": "masonry unit",
  "aliases": [
    "masonry unit",
    "Masonry Units"
  ],
  "link_in_text": true,
  "applies_to": {
    "land_use": "residential_plotted",
    "authority": "DDA"
  },
  "text": {
    "original": "Masonry Unit: A unit whose net cross-sectional area in every plane parallel to the baring surface is 75% or more of its gross cross-sectional area measured in the same plane. It may be either clay brick, stone, concrete block or sand-lime brick.",
    "original_lang": "en",
    "translated": null
  },
  "effective_from": "2016-03-22",
  "effective_to": null,
  "supersedes": null,
  "citations": [
    {
      "doc_id": "ubbl2016",
      "clause": "1.4.71",
      "page": 300,
      "bbox": [
        0.2164,
        0.8225,
        0.8777,
        0.8806
      ],
      "original_text": "Masonry Unit: A unit whose net cross-sectional area in every plane parallel to the baring surface is 75% or more of its gross cross-sectional area measured in the same plane. It may be either clay brick, stone, concrete block or sand-lime brick.",
      "original_lang": "en",
      "translated_text": null
    },
    {
      "doc_id": "ubbl2016_compendium_2020",
      "clause": "1.4.71",
      "page": 12,
      "bbox": [
        0.1442,
        0.1189,
        0.9189,
        0.1753
      ],
      "original_text": "Masonry Unit: A unit whose net cross-sectional area in every plane parallel to the baring surface is 75% or more of its gross cross-sectional area measured in the same plane. It may be either clay brick, stone, concrete block or sand-lime brick.",
      "original_lang": "en",
      "translated_text": null
    }
  ],
  "verification": {
    "status": "draft",
    "verified_by": null,
    "verified_on": null,
    "method": "pdf_text_extraction_v1",
    "confidence": null
  },
  "notes": "Read from the English text of ubbl2016, clause 1.4.71 by pipeline.definitions — no model involved. Confirm the text and box against the page. TODO(verify): effective_from 2016-03-22 is the date of S.O. 1191(E), as used by the verified UBBL rules; clause 1.0 says the bye-laws come into force on a date appointed by notification. Hindi text not read: the gazette's Hindi half uses a legacy font encoding (pipeline/README.md). Same text in ubbl2016_compendium_2020 p.12."
}
