{
  "definition_id": "ubbl2016.garage_public",
  "term": "garage, public",
  "aliases": [
    "garage, public"
  ],
  "link_in_text": true,
  "applies_to": {
    "land_use": "residential_plotted",
    "authority": "DDA"
  },
  "text": {
    "original": "Garage, Public: A building or portion thereof designed other than a private garage, operated for gain, designed or used for repairing, servicing, hiring, selling or storing motor driven or other driven vehicle.",
    "original_lang": "en",
    "translated": null
  },
  "effective_from": "2016-03-22",
  "effective_to": null,
  "supersedes": null,
  "citations": [
    {
      "doc_id": "ubbl2016",
      "clause": "1.4.54",
      "page": 299,
      "bbox": [
        0.2164,
        0.6108,
        0.8777,
        0.654
      ],
      "original_text": "Garage, Public: A building or portion thereof designed other than a private garage, operated for gain, designed or used for repairing, servicing, hiring, selling or storing motor driven or other driven vehicle.",
      "original_lang": "en",
      "translated_text": null
    },
    {
      "doc_id": "ubbl2016_compendium_2020",
      "clause": "1.4.54",
      "page": 11,
      "bbox": [
        0.1442,
        0.093,
        0.9189,
        0.1299
      ],
      "original_text": "Garage, Public: A building or portion thereof designed other than a private garage, operated for gain, designed or used for repairing, servicing, hiring, selling or storing motor driven or other driven vehicle.",
      "original_lang": "en",
      "translated_text": null
    }
  ],
  "verification": {
    "status": "draft",
    "verified_by": null,
    "verified_on": null,
    "method": "pdf_text_extraction_v1",
    "confidence": null
  },
  "notes": "Read from the English text of ubbl2016, clause 1.4.54 by pipeline.definitions — no model involved. Confirm the text and box against the page. TODO(verify): effective_from 2016-03-22 is the date of S.O. 1191(E), as used by the verified UBBL rules; clause 1.0 says the bye-laws come into force on a date appointed by notification. Hindi text not read: the gazette's Hindi half uses a legacy font encoding (pipeline/README.md). Same text in ubbl2016_compendium_2020 p.11."
}
