{
  "definition_id": "ubbl2016.mezzanine_floor",
  "term": "mezzanine floor",
  "aliases": [
    "mezzanine floor",
    "Mezzanine Floors"
  ],
  "link_in_text": true,
  "applies_to": {
    "land_use": "residential_plotted",
    "authority": "DDA"
  },
  "text": {
    "original": "Mezzanine Floor: An intermediate floor between two floor levels above ground floor and at least one side of it form an integral part of space/ floor below.",
    "original_lang": "en",
    "translated": null
  },
  "effective_from": "2016-03-22",
  "effective_to": null,
  "supersedes": null,
  "citations": [
    {
      "doc_id": "ubbl2016",
      "clause": "1.4.73",
      "page": 301,
      "bbox": [
        0.2164,
        0.1331,
        0.8777,
        0.1612
      ],
      "original_text": "Mezzanine Floor: An intermediate floor between two floor levels above ground floor and at least one side of it form an integral part of space/ floor below.",
      "original_lang": "en",
      "translated_text": null
    },
    {
      "doc_id": "ubbl2016_compendium_2020",
      "clause": "1.4.73",
      "page": 12,
      "bbox": [
        0.1442,
        0.2312,
        0.9189,
        0.2679
      ],
      "original_text": "Mezzanine Floor: An intermediate floor between two floor levels above ground floor and at least one side of it form an integral part of space/ floor below.",
      "original_lang": "en",
      "translated_text": null
    }
  ],
  "verification": {
    "status": "draft",
    "verified_by": null,
    "verified_on": null,
    "method": "pdf_text_extraction_v1",
    "confidence": null
  },
  "notes": "Read from the English text of ubbl2016, clause 1.4.73 by pipeline.definitions — no model involved. Confirm the text and box against the page. TODO(verify): effective_from 2016-03-22 is the date of S.O. 1191(E), as used by the verified UBBL rules; clause 1.0 says the bye-laws come into force on a date appointed by notification. Hindi text not read: the gazette's Hindi half uses a legacy font encoding (pipeline/README.md). Same text in ubbl2016_compendium_2020 p.12."
}
