{
  "definition_id": "ubbl2016.curtain_wall",
  "term": "curtain wall",
  "aliases": [
    "curtain wall",
    "Curtain Walls"
  ],
  "link_in_text": true,
  "applies_to": {
    "land_use": "residential_plotted",
    "authority": "DDA"
  },
  "text": {
    "original": "Curtain Wall: Curtain wall is a system in the form of structural glazing or any other energy efficient material to improve the energy efficiency of the building which does not form the part of the structural system of the parent building.",
    "original_lang": "en",
    "translated": null
  },
  "effective_from": "2016-03-22",
  "effective_to": null,
  "supersedes": null,
  "citations": [
    {
      "doc_id": "ubbl2016",
      "clause": "1.4.26",
      "page": 297,
      "bbox": [
        0.2164,
        0.5004,
        0.8777,
        0.5436
      ],
      "original_text": "Curtain Wall: Curtain wall is a system in the form of structural glazing or any other energy efficient material to improve the energy efficiency of the building which does not form the part of the structural system of the parent building.",
      "original_lang": "en",
      "translated_text": null
    },
    {
      "doc_id": "ubbl2016_compendium_2020",
      "clause": "1.4.26",
      "page": 9,
      "bbox": [
        0.1397,
        0.313,
        0.919,
        0.3697
      ],
      "original_text": "Curtain Wall: Curtain wall is a system in the form of structural glazing or any other energy efficient material to improve the energy efficiency of the building which does not form the part of the structural system of the parent building.",
      "original_lang": "en",
      "translated_text": null
    }
  ],
  "verification": {
    "status": "draft",
    "verified_by": null,
    "verified_on": null,
    "method": "pdf_text_extraction_v1",
    "confidence": null
  },
  "notes": "Read from the English text of ubbl2016, clause 1.4.26 by pipeline.definitions — no model involved. Confirm the text and box against the page. TODO(verify): effective_from 2016-03-22 is the date of S.O. 1191(E), as used by the verified UBBL rules; clause 1.0 says the bye-laws come into force on a date appointed by notification. Hindi text not read: the gazette's Hindi half uses a legacy font encoding (pipeline/README.md). Same text in ubbl2016_compendium_2020 p.9."
}
