{
  "definition_id": "ubbl2016.sight_disabilities",
  "term": "sight disabilities",
  "aliases": [
    "sight disabilities"
  ],
  "link_in_text": true,
  "applies_to": {
    "land_use": "residential_plotted",
    "authority": "DDA"
  },
  "text": {
    "original": "Sight Disabilities: Total blindness or impairment affecting sight to the extent that the individual functions in public areas is insecure or exposed to danger.",
    "original_lang": "en",
    "translated": null
  },
  "effective_from": "2016-03-22",
  "effective_to": null,
  "supersedes": null,
  "citations": [
    {
      "doc_id": "ubbl2016",
      "clause": "1.4.132",
      "page": 306,
      "bbox": [
        0.2164,
        0.1789,
        0.8776,
        0.207
      ],
      "original_text": "Sight Disabilities: Total blindness or impairment affecting sight to the extent that the individual functions in public areas is insecure or exposed to danger.",
      "original_lang": "en",
      "translated_text": null
    },
    {
      "doc_id": "ubbl2016_compendium_2020",
      "clause": "1.4.132",
      "page": 16,
      "bbox": [
        0.1442,
        0.2982,
        0.9188,
        0.3351
      ],
      "original_text": "Sight Disabilities: Total blindness or impairment affecting sight to the extent that the individual functions in public areas is insecure or exposed to danger.",
      "original_lang": "en",
      "translated_text": null
    }
  ],
  "verification": {
    "status": "draft",
    "verified_by": null,
    "verified_on": null,
    "method": "pdf_text_extraction_v1",
    "confidence": null
  },
  "notes": "Read from the English text of ubbl2016, clause 1.4.132 by pipeline.definitions — no model involved. Confirm the text and box against the page. TODO(verify): effective_from 2016-03-22 is the date of S.O. 1191(E), as used by the verified UBBL rules; clause 1.0 says the bye-laws come into force on a date appointed by notification. Hindi text not read: the gazette's Hindi half uses a legacy font encoding (pipeline/README.md). Same text in ubbl2016_compendium_2020 p.16."
}
