{
  "definition_id": "ubbl2016.fire_separation",
  "term": "fire separation",
  "aliases": [
    "fire separation",
    "Fire Separations"
  ],
  "link_in_text": true,
  "applies_to": {
    "land_use": "residential_plotted",
    "authority": "DDA"
  },
  "text": {
    "original": "Fire Separation: The distance in meters measured from other building on the site, or from other site, or from the opposite of a street or other public space to the building.",
    "original_lang": "en",
    "translated": null
  },
  "effective_from": "2016-03-22",
  "effective_to": null,
  "supersedes": null,
  "citations": [
    {
      "doc_id": "ubbl2016",
      "clause": "1.4.44",
      "page": 298,
      "bbox": [
        0.2164,
        0.7367,
        0.8777,
        0.7799
      ],
      "original_text": "Fire Separation: The distance in meters measured from other building on the site, or from other site, or from the opposite of a street or other public space to the building.",
      "original_lang": "en",
      "translated_text": null
    },
    {
      "doc_id": "ubbl2016_compendium_2020",
      "clause": "1.4.44",
      "page": 10,
      "bbox": [
        0.1442,
        0.3794,
        0.919,
        0.4163
      ],
      "original_text": "Fire Separation: The distance in meters measured from other building on the site, or from other site, or from the opposite of a street or other public space to the building.",
      "original_lang": "en",
      "translated_text": null
    }
  ],
  "verification": {
    "status": "draft",
    "verified_by": null,
    "verified_on": null,
    "method": "pdf_text_extraction_v1",
    "confidence": null
  },
  "notes": "Read from the English text of ubbl2016, clause 1.4.44 by pipeline.definitions — no model involved. Confirm the text and box against the page. TODO(verify): effective_from 2016-03-22 is the date of S.O. 1191(E), as used by the verified UBBL rules; clause 1.0 says the bye-laws come into force on a date appointed by notification. Hindi text not read: the gazette's Hindi half uses a legacy font encoding (pipeline/README.md). Same text in ubbl2016_compendium_2020 p.10."
}
